{"$schema":"https://json-schema.org/draft/2020-12/schema","$id":"https://axignal.com/schemas/library-contract-catalog.schema.json","title":"AXIGNAL Library Contract Catalog","type":"object","additionalProperties":false,"required":["schema_version","task_id","programme_version","status","canonical_activation_authorised","profiles","contracts"],"properties":{"schema_version":{"const":"axignal.library-contract-catalog/v0.1"},"task_id":{"const":"AX-GE2E-P02-T01"},"programme_version":{"const":"1.4.0"},"status":{"enum":["DRAFT_INDIVIDUAL_CONTRACTS","EVIDENCE_READY","ACCEPTED","SUPERSEDED"]},"canonical_activation_authorised":{"type":"boolean"},"profiles":{"type":"object","additionalProperties":false,"required":["shared_invariants","opportunity_lifecycle","opportunity_graph_roles","required_acceptance_tests"],"properties":{"shared_invariants":{"type":"object","additionalProperties":false,"required":["rights_ambiguity","generative_direct_admission","evidence_immutable","source_native_values_preserved","unknown_unavailable_zero_distinct","canonical_ledger_mutation_from_workspace","public_product_availability","rollback_preserves_lineage"],"properties":{"rights_ambiguity":{"const":"RESTRICTED"},"generative_direct_admission":{"const":false},"evidence_immutable":{"const":true},"source_native_values_preserved":{"const":true},"unknown_unavailable_zero_distinct":{"const":true},"canonical_ledger_mutation_from_workspace":{"const":false},"public_product_availability":{"const":false},"rollback_preserves_lineage":{"const":true}}},"opportunity_lifecycle":{"type":"array","minItems":13,"uniqueItems":true,"items":{"type":"string"}},"opportunity_graph_roles":{"type":"array","minItems":11,"maxItems":11,"uniqueItems":true,"items":{"type":"string"}},"required_acceptance_tests":{"type":"array","minItems":5,"uniqueItems":true,"items":{"type":"string"}}}},"contracts":{"type":"array","minItems":16,"maxItems":16,"items":{"$ref":"#/$defs/libraryContract"}}},"$defs":{"strings":{"type":"array","minItems":1,"uniqueItems":true,"items":{"type":"string","minLength":1}},"libraryContract":{"type":"object","additionalProperties":false,"required":["library_id","kind","canonical_name","version","state","dependencies","workspace_type","entities","predicates","events","lifecycle","time_axes","jurisdiction_rules","taxonomy_refs","opportunity_roles","exclusions","tests"],"properties":{"library_id":{"pattern":"^AX-LIB-[FO]0[1-9]$"},"kind":{"enum":["FOUNDATIONAL","OPPORTUNITY"]},"canonical_name":{"type":"string","minLength":3},"version":{"const":"0.1.0"},"state":{"const":"DRAFT"},"dependencies":{"type":"array","uniqueItems":true,"items":{"pattern":"^AX-LIB-F0[1-7]$"}},"workspace_type":{"type":["string","null"]},"entities":{"$ref":"#/$defs/strings"},"predicates":{"$ref":"#/$defs/strings"},"events":{"$ref":"#/$defs/strings"},"lifecycle":{"$ref":"#/$defs/strings"},"time_axes":{"type":"array","minItems":3,"uniqueItems":true,"items":{"enum":["published_at","retrieved_at","observed_at","event_at","valid_from","valid_to","effective_from","effective_to","revised_at","vintage_at","recorded_at"]}},"jurisdiction_rules":{"$ref":"#/$defs/strings"},"taxonomy_refs":{"$ref":"#/$defs/strings"},"opportunity_roles":{"type":"array","uniqueItems":true,"items":{"type":"string"}},"exclusions":{"type":"array","minItems":3,"uniqueItems":true,"items":{"type":"string","minLength":8}},"tests":{"type":"array","minItems":6,"uniqueItems":true,"items":{"type":"string"}}},"allOf":[{"if":{"properties":{"kind":{"const":"FOUNDATIONAL"}}},"then":{"properties":{"library_id":{"pattern":"^AX-LIB-F0[1-7]$"},"dependencies":{"maxItems":0},"workspace_type":{"type":"null"},"opportunity_roles":{"maxItems":0}}}},{"if":{"properties":{"kind":{"const":"OPPORTUNITY"}}},"then":{"properties":{"library_id":{"pattern":"^AX-LIB-O0[1-9]$"},"dependencies":{"minItems":7,"maxItems":7},"workspace_type":{"type":"string","minLength":3},"lifecycle":{"const":["$profile:opportunity_lifecycle"]},"opportunity_roles":{"const":["$profile:opportunity_graph_roles"]}}}}]}}}
