{"schema_version":"axignal.library-contract-catalog/v0.1","task_id":"AX-GE2E-P02-T01","programme_version":"1.4.0","status":"DRAFT_INDIVIDUAL_CONTRACTS","canonical_activation_authorised":false,"profiles":{"shared_invariants":{"rights_ambiguity":"RESTRICTED","generative_direct_admission":false,"evidence_immutable":true,"source_native_values_preserved":true,"unknown_unavailable_zero_distinct":true,"canonical_ledger_mutation_from_workspace":false,"public_product_availability":false,"rollback_preserves_lineage":true},"opportunity_lifecycle":["DETECTED","QUALIFYING","QUALIFIED","REJECTED","PURSUIT_OPEN","DECISION_PENDING","APPROVED","DECLINED","IN_EXECUTION","SUBMITTED_OR_ACTIVATED","WON_OR_REALIZED","LOST_OR_CLOSED","LEARNING_CAPTURED"],"opportunity_graph_roles":["problem_or_anomaly","affected_entity_or_payer","scale_or_frequency","market_access","competition","operational_feasibility","legal_or_regulatory_risk","ai_absorption_risk","contradictions","unknowns","invalidation_conditions"],"required_acceptance_tests":["SCHEMA_VALID","RIGHTS_FAIL_CLOSED","TEMPORAL_LINEAGE","NO_AI_ADMISSION_BYPASS","ROLLBACK_LINEAGE"]},"contracts":[{"library_id":"AX-LIB-F01","kind":"FOUNDATIONAL","canonical_name":"Jurisdiction and geography","version":"0.1.0","state":"DRAFT","dependencies":[],"workspace_type":null,"entities":["Jurisdiction","Place","AdministrativeArea","Region","Country","GeoBoundary"],"predicates":["CONTAINS","PART_OF","ADJACENT_TO","LOCATED_IN","SUCCESSOR_OF","EQUIVALENT_WITHIN_SCOPE"],"events":["BOUNDARY_REVISED","CODE_REASSIGNED","JURISDICTION_CREATED","JURISDICTION_DISSOLVED"],"lifecycle":["ACTIVE","HISTORICAL","DISPUTED","SUPERSEDED","UNKNOWN"],"time_axes":["valid_from","valid_to","effective_from","effective_to","recorded_at"],"jurisdiction_rules":["source_jurisdiction_required","disputed_scope_explicit","geometry_reference_versioned"],"taxonomy_refs":["ISO_3166","UN_M49","NUTS"],"opportunity_roles":[],"exclusions":["no universal geography claim","no silent resolution of disputed boundaries","no geometry inference without source"],"tests":["SCHEMA_VALID","RIGHTS_FAIL_CLOSED","TEMPORAL_LINEAGE","NO_AI_ADMISSION_BYPASS","ROLLBACK_LINEAGE","AX-LIB-F01_DOMAIN_SEMANTICS"]},{"library_id":"AX-LIB-F02","kind":"FOUNDATIONAL","canonical_name":"Entities, organisations and ownership","version":"0.1.0","state":"DRAFT","dependencies":[],"workspace_type":null,"entities":["Organisation","PublicBody","Company","Person","OwnershipInterest","Identifier"],"predicates":["IDENTIFIED_BY","ALIAS_OF","OWNS","CONTROLLED_BY","SUBSIDIARY_OF","SUCCEEDS"],"events":["ENTITY_CREATED","ENTITY_RENAMED","IDENTIFIER_CHANGED","OWNERSHIP_CHANGED","ENTITY_SPLIT"],"lifecycle":["UNRESOLVED","CANDIDATE_MATCH","RESOLVED","CONTESTED","SPLIT","SUPERSEDED"],"time_axes":["observed_at","valid_from","valid_to","recorded_at"],"jurisdiction_rules":["entity_jurisdiction_scoped","ownership_jurisdiction_preserved","person_scope_restricted"],"taxonomy_refs":["LEI","VAT_ID","COMPANY_REGISTER_ID"],"opportunity_roles":[],"exclusions":["no silent entity merge","no collapse of observed and inferred ownership","no personal-data enrichment without authority"],"tests":["SCHEMA_VALID","RIGHTS_FAIL_CLOSED","TEMPORAL_LINEAGE","NO_AI_ADMISSION_BYPASS","ROLLBACK_LINEAGE","AX-LIB-F02_DOMAIN_SEMANTICS"]},{"library_id":"AX-LIB-F03","kind":"FOUNDATIONAL","canonical_name":"Taxonomies and classifications","version":"0.1.0","state":"DRAFT","dependencies":[],"workspace_type":null,"entities":["Taxonomy","TaxonomyVersion","Concept","Label","Crosswalk","MappingAssertion"],"predicates":["HAS_CONCEPT","BROADER_THAN","NARROWER_THAN","EQUIVALENT_TO","MAPS_TO","SUPERSEDES"],"events":["TAXONOMY_VERSION_PUBLISHED","CONCEPT_ADDED","CONCEPT_RETIRED","CROSSWALK_PROPOSED","CROSSWALK_ADMITTED"],"lifecycle":["DRAFT","ACTIVE","RETIRED","SUPERSEDED","CONTESTED"],"time_axes":["valid_from","valid_to","published_at","recorded_at"],"jurisdiction_rules":["publisher_scope_required","jurisdiction_scope_explicit"],"taxonomy_refs":["CPV","NUTS","NAICS","PSC","NACE","ISIC","HS","SITC","CPC"],"opportunity_roles":[],"exclusions":["no source-native code mutation","no one-to-one assumption for crosswalks","no unversioned taxonomy"],"tests":["SCHEMA_VALID","RIGHTS_FAIL_CLOSED","TEMPORAL_LINEAGE","NO_AI_ADMISSION_BYPASS","ROLLBACK_LINEAGE","AX-LIB-F03_DOMAIN_SEMANTICS"]},{"library_id":"AX-LIB-F04","kind":"FOUNDATIONAL","canonical_name":"Time, currency, value and units","version":"0.1.0","state":"DRAFT","dependencies":[],"workspace_type":null,"entities":["TimeInstant","TimeInterval","Currency","MonetaryValue","Unit","Quantity"],"predicates":["DENOMINATED_IN","MEASURED_IN","VALID_DURING","EFFECTIVE_DURING","CONVERTED_USING","HAS_RANGE"],"events":["RATE_PUBLISHED","UNIT_REVISED","VALUE_RESTATED","PERIOD_CLOSED","VINTAGE_RELEASED"],"lifecycle":["CURRENT","HISTORICAL","PROVISIONAL","REVISED","UNKNOWN"],"time_axes":["published_at","retrieved_at","observed_at","event_at","valid_from","valid_to","effective_from","effective_to","revised_at","vintage_at","recorded_at"],"jurisdiction_rules":["calendar_explicit","timezone_explicit","currency_jurisdiction_preserved"],"taxonomy_refs":["ISO_4217","UCUM"],"opportunity_roles":[],"exclusions":["no missing-time substitution with now","no currency conversion without rate and timestamp","no zero coercion for unknown values"],"tests":["SCHEMA_VALID","RIGHTS_FAIL_CLOSED","TEMPORAL_LINEAGE","NO_AI_ADMISSION_BYPASS","ROLLBACK_LINEAGE","AX-LIB-F04_DOMAIN_SEMANTICS"]},{"library_id":"AX-LIB-F05","kind":"FOUNDATIONAL","canonical_name":"Languages, terminology and translation","version":"0.1.0","state":"DRAFT","dependencies":[],"workspace_type":null,"entities":["Language","Locale","Term","Definition","Translation","Transliteration"],"predicates":["HAS_TERM","DEFINED_AS","TRANSLATES_TO","TRANSLITERATES_TO","PREFERRED_IN","SOURCE_LABEL_OF"],"events":["TERM_ADDED","DEFINITION_REVISED","TRANSLATION_PROPOSED","TRANSLATION_REVIEWED","TERM_DEPRECATED"],"lifecycle":["SOURCE_NATIVE","PROPOSED","REVIEWED","ADMITTED","DEPRECATED","CONTESTED"],"time_axes":["published_at","valid_from","valid_to","recorded_at"],"jurisdiction_rules":["locale_required","jurisdictional_meaning_preserved"],"taxonomy_refs":["BCP_47","ISO_639"],"opportunity_roles":[],"exclusions":["no overwrite of source-native text","no machine translation treated as legal equivalence","no language inference from country alone"],"tests":["SCHEMA_VALID","RIGHTS_FAIL_CLOSED","TEMPORAL_LINEAGE","NO_AI_ADMISSION_BYPASS","ROLLBACK_LINEAGE","AX-LIB-F05_DOMAIN_SEMANTICS"]},{"library_id":"AX-LIB-F06","kind":"FOUNDATIONAL","canonical_name":"Source rights and provenance","version":"0.1.0","state":"DRAFT","dependencies":[],"workspace_type":null,"entities":["Source","SourceVersion","RightsSnapshot","AccessMechanism","Parser","LineageGroup"],"predicates":["OWNED_BY","GOVERNED_BY","ACCESSED_VIA","PARSED_BY","DERIVED_FROM","REQUIRES_ATTRIBUTION"],"events":["RIGHTS_REVIEWED","ACCESS_CHANGED","PARSER_RELEASED","SOURCE_SUSPENDED","SOURCE_REVOKED"],"lifecycle":["DISCOVERED","LEGAL_REVIEW","TECHNICAL_PROBE","EVIDENCE_READY","PRODUCT_ADMITTED","PRIVATE_ACCEPTANCE","COMMERCIAL","RESTRICTED","SUSPENDED","REVOKED","REJECTED"],"time_axes":["published_at","retrieved_at","valid_from","valid_to","revised_at","recorded_at"],"jurisdiction_rules":["owner_jurisdiction_required","processing_jurisdiction_recorded"],"taxonomy_refs":["RIGHTS_DIMENSION_V1"],"opportunity_roles":[],"exclusions":["no accessibility-equals-admissibility inference","no evidence admission without rights snapshot","no claim contribution while kill switch active"],"tests":["SCHEMA_VALID","RIGHTS_FAIL_CLOSED","TEMPORAL_LINEAGE","NO_AI_ADMISSION_BYPASS","ROLLBACK_LINEAGE","AX-LIB-F06_DOMAIN_SEMANTICS"]},{"library_id":"AX-LIB-F07","kind":"FOUNDATIONAL","canonical_name":"Documents and content","version":"0.1.0","state":"DRAFT","dependencies":[],"workspace_type":null,"entities":["Document","DocumentVersion","ContentObject","Section","Passage","Attachment"],"predicates":["HAS_VERSION","CONTAINS","ATTACHED_TO","CITES","AMENDS","SUPERSEDES"],"events":["DOCUMENT_PUBLISHED","DOCUMENT_AMENDED","DOCUMENT_WITHDRAWN","CONTENT_EXTRACTED","SIGNATURE_VERIFIED"],"lifecycle":["DRAFT","PUBLISHED","AMENDED","SUPERSEDED","WITHDRAWN","UNAVAILABLE"],"time_axes":["published_at","retrieved_at","effective_from","effective_to","revised_at","recorded_at"],"jurisdiction_rules":["publisher_jurisdiction_preserved","document_scope_explicit"],"taxonomy_refs":["MIME_TYPE","DOCUMENT_TYPE"],"opportunity_roles":[],"exclusions":["no mutable evidence payload","no parser output without raw reference","no withdrawn document represented as current"],"tests":["SCHEMA_VALID","RIGHTS_FAIL_CLOSED","TEMPORAL_LINEAGE","NO_AI_ADMISSION_BYPASS","ROLLBACK_LINEAGE","AX-LIB-F07_DOMAIN_SEMANTICS"]},{"library_id":"AX-LIB-O01","kind":"OPPORTUNITY","canonical_name":"Global Public Procurement","version":"0.1.0","state":"DRAFT","dependencies":["AX-LIB-F01","AX-LIB-F02","AX-LIB-F03","AX-LIB-F04","AX-LIB-F05","AX-LIB-F06","AX-LIB-F07"],"workspace_type":"Bid Workspace","entities":["ProcurementOpportunity","Notice","Procedure","Buyer","Lot","Award"],"predicates":["PUBLISHED_BY","HAS_LOT","HAS_REQUIREMENT","AWARDED_TO","CONTRACTS_WITH","CLASSIFIED_AS"],"events":["NOTICE_PUBLISHED","NOTICE_CORRECTED","DEADLINE_CHANGED","AWARD_PUBLISHED","CONTRACT_SIGNED"],"lifecycle":["$profile:opportunity_lifecycle"],"time_axes":["published_at","retrieved_at","event_at","valid_from","valid_to","recorded_at"],"jurisdiction_rules":["buyer_jurisdiction_required","place_of_performance_explicit"],"taxonomy_refs":["CPV","NUTS","PSC","NAICS"],"opportunity_roles":["$profile:opportunity_graph_roles"],"exclusions":["no eligibility conclusion without evidence","no bid submission authority","no global procurement coverage claim"],"tests":["SCHEMA_VALID","RIGHTS_FAIL_CLOSED","TEMPORAL_LINEAGE","NO_AI_ADMISSION_BYPASS","ROLLBACK_LINEAGE","AX-LIB-O01_DOMAIN_SEMANTICS"]},{"library_id":"AX-LIB-O02","kind":"OPPOR